{
  "id": "science-lab-college",
  "title": "전문대·대학 화학·생명·환경 관련 학과",
  "kind": "school",
  "official_url": "https://www.law.go.kr/법령/국가기술자격법시행령",
  "summary": "화학과, 생명과학과, 화학공학과, 환경공학과 같은 학과에서 배워요. 검정고시로 고졸 학력을 인정받으면 지원할 수 있고, 입학 전형과 학비는 학교마다 달라서 모집요강으로 확인해요. 관련 학과 전문대를 졸업(예정)하면 산업기사, 대학을 졸업(예정)하면 화학분석기사 같은 기사 시험을 볼 수 있어요."
}
