{
  "id": "sports-health-trainer-exam",
  "title": "건강운동관리사 따기",
  "kind": "exam",
  "official_url": "https://sqms.kspo.or.kr/info/licenseInfoHexm.kspo",
  "summary": "체육 분야 전문학사 이상을 졸업(예정)한 사람이 볼 수 있는 국가 자격이에요. 졸업 예정자는 마지막 학년 때 볼 수 있지만, 졸업하지 못하면 합격이 취소돼요. 필기 8과목과 실기·구술시험(심폐소생술·응급처치, 체력 측정 등)을 보고 200시간 이상 연수를 마쳐요. 응시료와 연수비를 합치면 47만 원쯤 들어요(2026년 기준). 의사나 한의사의 의뢰를 받아 운동이 필요한 사람의 운동 방법을 지도·관리할 수 있어요."
}
