{
  "id": "science-lab-researcher",
  "title": "대학원 거쳐 연구원 되기",
  "kind": "job",
  "official_url": "https://www.career.go.kr/cloud/w/job/view?seq=86",
  "summary": "커리어넷은 생물공학연구원(생명과학연구원)이 되려면 대학에서 생물 관련 전공을 하고 대학원에서 석사나 박사 학위를 받는 것이 유리하다고 안내해요. 워크넷 2021년 자료로 생물학연구원은 대졸 30%, 대학원졸 37%, 박사 33%였어요. 제약·식품 회사, 대학 부설 연구소, 정부 출연 연구기관 등에서 일해요."
}
