{
  "id": "science-lab-industry-job",
  "title": "화학·바이오 회사 생산·품질 일 시작하기",
  "kind": "job",
  "official_url": "https://www.career.go.kr/cloud/w/job/view?seq=153",
  "summary": "화학·바이오 회사의 생산·품질 일이나, 물·공기 오염을 재는 환경 측정 회사·실험실 일로 시작해요. 커리어넷은 화학제품제조원에 고졸 이상 학력이 필요하고 들어가서 견습으로 배운다고 안내해요. 기능사를 따고 같은 분야에서 1년 일하면 산업기사, 3년이면 기사 시험을 볼 수 있어요. 만 15세 미만이거나 중학생이면 취직인허증이 필요해요. 만 18세 미만은 하루 7시간·주 35시간이 기본이고, 밤 10시~아침 6시와 휴일 일, 기름(유류)을 다루는 일 같은 유해·위험 업무는 원칙적으로 안 돼요. 보호자 동의서도 필요해요."
}
