{
  "id": "design-video-freelance",
  "title": "작은 의뢰 받기·크리에이터로 올려 보기",
  "kind": "job",
  "official_url": "https://www.easylaw.go.kr/CSP/SolomonRetrieve.laf?trialNo=1303&topMenu=serviceUl6&sortType=TTLNM",
  "summary": "아는 사람의 포스터·영상 편집 의뢰를 받거나, 내 영상을 채널에 올려 봐요. 얼굴·학교·사는 곳 같은 개인정보가 드러나지 않게 조심해요. 수입은 일정하지 않고 사람마다 차이가 아주 커서, 이것만으로 생활하기는 어려운 경우가 많아요. 미성년자가 보호자 동의 없이 한 계약은 나중에 취소될 수 있어서, 돈이 오가는 일은 보호자와 함께 정해요."
}
