{
  "id": "office-finance-computer-license",
  "title": "컴퓨터활용능력 따기",
  "kind": "license",
  "official_url": "https://www.q-net.or.kr/crf005.do?id=crf00503&jmCd=0493",
  "summary": "엑셀 같은 스프레드시트와 데이터베이스를 다루는 능력을 보는 국가기술자격이에요. 1급과 2급이 있고, 나이·학력 응시 제한이 없어요. 필기와 실기를 봐요. 시험은 대한상공회의소가 열어서 일정과 비용은 대한상공회의소 자격평가사업단에서 확인해요. 문서 작성 쪽은 워드프로세서, 민간 공인자격인 ITQ도 있어요. 국가공무원 9급 행정직 시험에서는 이 자격증들로 가산점을 받지 않아요."
}
