{
  "id": "office-finance-office-job",
  "title": "사무·회계 일 시작하기",
  "kind": "job",
  "official_url": "https://www.work24.go.kr/wk/a/b/1200/retriveDtlEmpSrchList.do",
  "summary": "회사의 사무원, 회계사무원, 세무사무소 직원 같은 일을 해요. 뽑는 조건은 회사마다 달라서 고용24 채용정보에서 '사무'나 '회계'로 찾아보고, 공고에 적힌 자격증과 경력을 확인해요. 만 18세 미만이면 근로시간 제한과 서면 근로계약서 같은 보호 규정이 똑같이 적용돼요."
}
