{
  "id": "design-video-cg-license",
  "title": "컴퓨터그래픽기능사 따기",
  "kind": "license",
  "official_url": "https://www.q-net.or.kr/crf005.do?id=crf00503&jmCd=7796",
  "summary": "그래픽 디자인 국가기술자격이에요. 필기와 실기 시험이 있고, 기능사는 응시 자격 제한이 없어요. 웹 쪽이 좋으면 웹디자인개발기능사, 사진 쪽이면 사진기능사도 있어요. 정기 기능사 시험은 1년에 여러 번 있고, 일정과 비용은 큐넷 공고로 확인해요."
}
