{
  "id": "office-finance-vocational-hs",
  "title": "특성화고 회계·사무 관련 학과",
  "kind": "school",
  "official_url": "https://www.hifive.go.kr/stats/schInfoList.do?rootMenuId=01&menuId=010101",
  "summary": "회계, 세무, 사무를 배우는 학과가 있는 특성화고예요. 하이파이브 누리집 학교목록에서 학과명에 '회계', '세무', '사무'를 넣으면 학교를 찾을 수 있어요. 학교에 따라 자격증 준비를 수업과 함께 하기도 해요. 학교를 그만뒀다면 다시 들어가거나 옮겨 갈 수 있는지 가고 싶은 학교에 물어봐요."
}
