{
  "id": "sports-youth-coach-exam",
  "title": "유소년스포츠지도사 따기",
  "kind": "exam",
  "official_url": "https://sqms.kspo.or.kr/info/licenseInfoYusc.kspo",
  "summary": "만 3세부터 중학교에 들어가기 전 아이들에게 운동을 가르치는 국가 자격이에요. 만 18세 이상이면 학력 조건 없이 볼 수 있어요. 필기(유아체육론은 꼭 봐요)와 실기·구술시험을 보고 90시간 이상 연수를 마쳐요. 응시료와 연수비를 합치면 27만 원쯤 들어요(2026년 기준). 아이들과 몸으로 노는 게 즐겁다면 생각해 볼 만해요."
}
