{
  "id": "police-safety-academy",
  "title": "합격 후 신임교육 받고 현장으로",
  "kind": "training",
  "official_url": "https://www.cpa.go.kr/www/newly_police/curriculumn.jsp",
  "summary": "경찰은 합격하면 중앙경찰학교 같은 경찰교육기관에서 신임교육을 받아요. 중앙경찰학교는 일반순경 과정을 38주로 안내해요. 교육을 마치면 1년 동안 시보로 일한 뒤 정식 경찰관이 되고, 신임교육 성적에 따라 임용 순서가 정해져요. 소방은 소방학교에서 신임교육을 받고, 소방사는 6개월 시보를 거쳐요. 임용 전에 소방학교에서 교육받은 기간도 시보 기간에 들어가요. 소방은 신임교육을 받은 기간 이상은 소방관으로 일해야 해요."
}
