{
  "id": "nursing-health-aide-training",
  "title": "간호조무사 교육훈련기관에서 교육 받기",
  "kind": "training",
  "official_url": "https://www.law.go.kr/법령/간호법시행규칙/제2조",
  "typical_duration": "이론 740시간 + 실습 780시간 이상",
  "summary": "보건복지부가 지정한 교육훈련기관(학원, 국·공립 양성소 등)에서 이론 740시간 이상, 병원·보건소 실습 780시간 이상을 마쳐요. 학원 과정은 고등학교 졸업 학력(검정고시 포함)이 있어야 해요. 학원비가 드니 등록 전에 지정 기관인지와 비용을 꼭 확인해요. 고용24에는 국민내일배움카드로 들을 수 있는 간호조무사 과정도 있어요. 카드로 지원을 받아도 내가 내는 돈이 있고, 고등학교 1~2학년 학생은 카드를 받을 수 없어요."
}
