{
  "id": "pets-work",
  "title": "반려동물 곁에서 일하기",
  "kind": "job",
  "official_url": "https://www.law.go.kr/법령/동물보호법/제73조",
  "summary": "동물병원, 반려동물 미용실, 위탁관리(맡아서 돌보거나 훈련하는 곳), 보호센터, 훈련소 같은 곳에서 일해요. 미용실·위탁관리 가게는 시·군·구청에 등록한 곳인지 봐요. 진료는 수의사만 할 수 있어요. 만 18세 미만은 하루 7시간·1주 35시간까지, 밤 10시~아침 6시에는 원칙적으로 일할 수 없어요. 부모님 동의서와 서면 근로계약서가 필요하고, 만 15세가 안 됐거나 중학생이면 취직인허증이 있어야 해요."
}
