{
  "id": "business-sales-vocational-hs",
  "title": "특성화고 경영·유통 관련 학과",
  "kind": "school",
  "official_url": "https://www.hifive.go.kr/stats/schInfoList.do?rootMenuId=01&menuId=010101",
  "summary": "경영, 유통, 비즈니스 같은 학과가 있는 특성화고에서 친구들과 함께 배워요. 하이파이브 누리집 학교목록에서 검색조건을 '학과명'으로 두고 '경영'이나 '유통'을 넣으면 학교를 찾을 수 있어요. 배우는 과목은 학교마다 달라요. 학교를 그만뒀다면 다시 들어가거나 옮겨 갈 수 있는지 가고 싶은 학교에 물어봐요."
}
