{
  "id": "pets-mission-find-shelter",
  "title": "우리 동네 동물보호센터와 봉사 모집글 찾아보기",
  "kind": "mission",
  "official_url": "https://www.animal.go.kr/front/awtis/institution/institutionList.do?menuNo=1000000059",
  "summary": "국가동물보호정보시스템에서 사는 곳과 가까운 동물보호센터를 찾아 적어 둬요. 그다음 1365 자원봉사포털에서 '유기동물'로 봉사 모집글을 찾아 읽어요. 성인만 받는 곳이 많으니 신청대상에 '청소년'이 있는지 꼭 봐요. 청소년도 받는 곳이 있으면 하루 신청해 봐요. 없으면 센터에 전화해서 청소년이 할 수 있는 활동이 있는지 물어봐요."
}
