{
  "id": "mechanic-field-work",
  "title": "정비·기계 현장에서 일하기",
  "kind": "job",
  "official_url": "https://www.law.go.kr/법령/자동차관리법시행규칙/제135조",
  "summary": "자동차 정비소, 공장 설비 관리, 용접·배관 현장 등에서 일하며 경력을 쌓아요. 무거운 부품, 소음, 기름, 불꽃을 다루는 일이 많아서 안전 장비와 안전 교육이 꼭 필요해요. 정비소에서 정비를 책임지는 '정비책임자'가 되려면 자동차정비 산업기사 이상이거나, 기능사를 따고 정비·검사 일을 3년 이상 한 경력이 있어야 해요."
}
