{
  "id": "sports-coach-work",
  "title": "체육시설에서 운동 가르치기",
  "kind": "job",
  "official_url": "https://www.law.go.kr/법령/체육시설의설치ㆍ이용에관한법률/제23조",
  "summary": "헬스장, 체육도장, 수영장, 체육교습 시설 같은 곳에서 운동을 가르쳐요. 이런 체육시설은 법에 따라 체육지도자 자격이 있는 사람을 1명 이상 둬야 해요. 퍼스널트레이너(PT)가 내세우는 '자격증' 가운데는 민간 단체가 만든 민간자격도 많아요. 국가 자격인지는 체육지도자 누리집에서 확인할 수 있어요."
}
