{
  "id": "office-finance-civil-exam",
  "title": "9급 공무원 공개채용 시험",
  "kind": "exam",
  "official_url": "https://www.law.go.kr/법령/공무원임용시험령/제16조",
  "summary": "나라나 지방자치단체에서 일할 사람을 뽑는 시험이에요. 국가공무원 시험은 학력 제한이 없고, 시험을 보는 해에 만 18세 이상이면 응시할 수 있어요(교정·보호 직렬은 20세 이상). 검정고시가 없어도 볼 수 있어요. 지방공무원도 시·도 규칙에 같은 만 18세 기준이 있어요. 과목과 일정, 응시 조건은 해마다 인사혁신처(국가직)와 시·도(지방직) 공고로 확인해요."
}
