{
  "id": "sports-field-helper",
  "title": "체육 행사 봉사나 센터 일손 돕기",
  "kind": "experience",
  "official_url": "https://www.1365.go.kr/vols/main.do",
  "summary": "체육 대회·행사 봉사나 스포츠센터 안내·정리 같은 일로 현장을 겪어 봐요. 봉사 모집글은 1365 자원봉사포털에서 찾고, 청소년이 할 수 있는지는 글마다 달라요. 만 18세가 안 됐으면 보호자 동의서와 서면 근로계약서가 있어야 일할 수 있고, 하루 7시간·1주 35시간이 기본이에요. 밤 10시~아침 6시와 휴일에는 원칙적으로 일할 수 없어요. 만 15세가 안 됐거나 중학생이면 고용노동부 취직인허증도 있어야 해요."
}
