{
  "id": "business-sales-online-shop",
  "title": "내 온라인 가게 열기",
  "kind": "other",
  "official_url": "https://www.easylaw.go.kr/CSP/CnpClsMain.laf?popMenu=ov&csmSeq=25&ccfNo=1&cciNo=1&cnpClsNo=2",
  "summary": "인터넷에서 물건을 계속 팔며 장사를 하려면 세무서에 사업자등록을 하고, 시·군·구청에 통신판매업 신고를 해요. 지난해 거래가 50회 미만이거나 간이과세자면 신고를 안 해도 된다는 기준이 있어요. 19세 미만은 부모님(법정대리인) 동의가 있어야 가게를 열 수 있고, 사업자등록 때 동의서를 함께 내요. 미성년자가 영업하면 등기소에 등기하라는 법 조항도 있으니 필요한지 세무서나 등기소에 물어봐요. 물건값과 광고비를 먼저 쓰기 때문에 손해를 볼 수도 있어요."
}
