{
  "id": "sports-life-coach-exam",
  "title": "2급 생활스포츠지도사 따기",
  "kind": "exam",
  "official_url": "https://sqms.kspo.or.kr/info/licenseInfoLsc2.kspo",
  "summary": "학력이나 전공 조건 없이 만 18세 이상이면 도전할 수 있는 체육지도자 국가 자격이에요. 축구, 수영, 보디빌딩 같은 종목 하나를 골라 필기시험과 실기·구술시험을 보고, 90시간 이상 연수를 마치면 자격증이 나와요. 시험은 보통 1년에 한 번이고, 그해 일정은 2~3월쯤 체육지도자 누리집에 올라와요. 응시료와 연수비를 합치면 27만 원쯤 들어요(2026년 기준)."
}
