{
  "id": "nursing-health-mission-find-aed",
  "title": "우리 동네 자동심장충격기 찾고 심폐소생술 순서 익히기",
  "kind": "mission",
  "official_url": "https://www.e-gen.or.kr/egen/search_aed.do",
  "summary": "중앙응급의료센터 E-GEN에서 집이나 학교 가까이 있는 자동심장충격기(AED) 위치를 하나 찾아 적어 봐요. 같은 사이트의 심폐소생술 안내를 읽고 순서를 따라 말해 봐요. 여기까지는 돈이 들지 않아요. 직접 실습해 보고 싶으면 대한적십자사나 가까운 소방서의 심폐소생술 교육을 알아봐요. 교육비가 있는 곳도 있으니 미리 확인해요."
}
