{
  "id": "pets-animal-health-college",
  "title": "전문대 이상 동물보건(간호) 관련 학과",
  "kind": "school",
  "official_url": "https://vt-exam.or.kr/1013/view/10087",
  "summary": "농림축산식품부의 평가인증을 받은 전문대 이상 학교의 동물 간호 관련 학과를 졸업하면 동물보건사 시험을 볼 수 있어요. 졸업 6개월 전부터 응시할 수 있어요. 인증받은 학과 목록은 동물보건사 자격관리시스템 공지에 있고, 인증에는 기간이 있으니 지원할 때 확인해요. 검정고시로 학력을 인정받으면 지원할 수 있고, 입학 전형과 학비는 대학마다 달라요."
}
