{
  "id": "writing-contest",
  "title": "글쓰기 공모전에 내 보기",
  "kind": "experience",
  "official_url": "https://www.career.go.kr/cloud/w/job/view?seq=973",
  "summary": "청소년 문학상이나 기관·지역 백일장 같은 글쓰기 공모전에 작품을 내 봐요. 소설가는 언론사가 여는 신춘문예에 당선되거나 문학잡지 추천을 받아 활동을 시작할 수 있어요. 응모 나이, 분량, 마감은 공모마다 달라서 요강으로 확인하고, 당선작의 저작권이 누구에게 가는지도 꼭 읽어요. 떨어져도 쓴 글은 내 작품으로 남아요."
}
